Question,label
A baker made 2 batches of chocolate chip cookies. Each batch had 3 cookies in it. Then he made an additional 4 oatmeal cookies just in case someone didn't want chocolate chip. How many cookies did he bake total?,4
Mrs. Hilt bought 3 pizzas for $8 each. What was the total amount she paid for the three pizzas?,3
Oceanside Bike Rental Shop charges a 17 dollar fixed fee plus 7 dollars an hour for renting a bike. Mary paid 80 dollars to rent a bike. How many hours did she pay to have the bike checked out ?,8
Sally memorized eight poems. After some time she could only recite three of them. How many poems did she forget?,12
"A new building needed 14 windows. The builder had already installed 5 of them. If it takes 4 hours to install each window, how long will it take him to install the rest?",10
Ned was buying books about astronomy. He bought 8 books about the planets and 4 about the space program. How many books did he buy total?,0
"For homework, a student had to complete 15 problems total. If she finished 6 problems in class, what is the ratio of problems she still needs to complete to problems that she's already finished?",10
"It takes eight grams of plastic to make a ruler. If a company had eight hundred twenty-eight grams of plastic, how many entire rulers could they make?",6
2 beavers were working on their home. 1 went for a swim. How many beavers are still working on their home?,12
"Virginia had 13 Sweettarts. If Virginia gave equal numbers of Sweettarts to her 4 friends and then she ate what was left, how many Sweettarts did each person eat?",4
Lindsey has 16 cans of regular soda and 8 cans of diet soda. She wants to create some identical refreshment tables that will operate during the football game. She also doesn't want to have any sodas left over. What is the greatest number of refreshment tables that Lindsey can stock?,9
"There are 43 students and 1720 apples. Each student has 9 Skittles. If the apples are divided equally among the students,how many does each student get?",7
Kim has 4 cousins. She wants to give each one 5 pieces of gum. How much gum will she need?,3
"Sofia, president of the school student organization, held a meeting to talk about the food being served at the school cafeteria. The first order of business is to discuss whether the students like the food being served at the school. If 383 students said that they like the food and 431 students said they didn't, how many students participated in the discussion?",1
I have 28 cents in my pocket. How coins could I have on minimization?,6
An art museum had 15 pictures to split equally into 2 different exhibits. How many more pictures would they need to make sure each exhibit had the same amount?,12
A chef used five potatoes to make fries for the lunch crowd. Later he used another two potatoes for the dinner crowd. How many potatoes did he use total?,12
"At summer camp the ratio of boys to girls was 10:1. If there were 30 boys, how many girls were there?",11
A recipe for cookies calls for 3 cups of sugar. Katie has already put in half a cup. How many more cups does she need to put in?,5
There are 43 empty seats and 7 occupied seats on an airplane. What is the ratio of the number of occupied seats to the total number of seats?,2
"Jenny goes to dance class every 6 days, karate class every 12 days, and to the library every 18 days. On December 1st she went to both classes and the libary. How many days from December 1st will she do both classes and go to the library?",9
"Simon, Mark, Kevin, and Carl love collecting stamps. They meet up every month to compare and share their collections with each other. During the previous month, Kevin was able to collect 45 stamps while Simon was only able to collect 27. How many more stamps does Kevin have more than Simon?",2
Joan is baking a cake. The recipe calls for 7 cups of flour. She already put in 3 cups. How many more cups does she need to add ?,12
Dave was making ice using ice trays. He originally had two ice cubes. But made seven more cubes. How many ice cubes did he have totaled?,12
"Thanksgiving came and their family hosted their building's Thanksgiving dinner. They prepared a lot of food so she asked her parents if they could donate some to the soup kitchen next bock. If they prepared 36 turkeys and gave 18 of it to the soup kitchen, how many were left for them to eat?",2
"Abigail's mom said she will be home from work in 65 minutes. It is 4:27 p.m., and Abigail has dance practice at 6:00 p.m. How much time will Abigail have between the time that her mom gets home from work and the beginning of dance practice?",5
"Mr. Lee wants to load 134 tons of his fruits. A large truck can load 15 tons of fruits and small truck can load 7 tons. In order to use the least number of trucks and have every truck fully occupied, how many small trucks should be used?",7
Mrs. Hilt has 15 friends. She can only take 8 of her friends to the movies. How many friends can't go to the movies?,0
"The very first thing that Rachel tried when they reached England was the food. If she ate 276 grams of bacon and 147 grams of sausages, how much food did she eat in total?",1
An art museum had 15 pictures to split equally into 2 different exhibits. How many more pictures would they need to make sure each exhibit had the same amount?,6
"Three workers are working to cut the trees. Worker X can cut a tree every 16 min, Worker Y every 32 min and Worker C every 24 min. If they start cutting three trees at the same time at 7:48, at what time will they start cutting trees at the same time again?",7
Emily owned 6 songs by her favorite artists. Later on she bought 7 more songs. How many songs did she have totaled?,0
Last week Howard had 26 dollars. He washed windows over the weekend and now has 52 dollars. How much money did he make washing windows?,2
A cafeteria was putting milk cartons into stacks. They had seven hundred ninety-nine cartons and were putting them into stacks with six cartons in each stack. How many full stacks could they make?,6
"A chess club has 3 members. If 4 new members are enrolled, how many total members are there in the chess club?",12
"Sarah could send ten text messages a day. If she sent eight, how many text messages does she have left she can send?",12
Mrs. Hilt made 5 Rice Krispie Treats. She used 8 large marshmallows and 10 mini marshmallows. How many marshmallows did she use altogether?,0
At the arcade Billy had won forty-eight tickets. After buying a yoyo he had thirty-two tickets left. How many tickets did the yoyo cost?,2
"There are some passengers on a bus. At a bus stop, 7 more passengers got on the bus and 9 passengers got off. If there are 26 passengers in the bus in the end, how many passengers were there at first?",2
"Charlie, an aspiring inventor, is planning to make some wings to fulfill his dream to fly around the world. He started by collecting feathers. He needs 900 feathers and he already has 387. How many more feathers does he need to collect?",1
"The cafeteria had fifty-one apples. For lunch they handed out forty-one to students and decided to use the rest to make pies. If each pie takes five apples, how many pies could they make?",4
"Mr. Fortree, a businessman also gave seedlings for the tree planting activity. If he gave 14 seedlings of cedar and 38 seedlings of pine, how many seedlings did he give in total?",2
"An industrial machine can make three hundred twenty-one crayons a day. If each box of crayons has seven crayons in it, how many full boxes does the machine make a day?",6
Adam was reading through his favorite book series. The first week he read 5 different books. The next week he read 8 books. How many books did he read total?,2
"At the edge of the forest, an anthill is blocking the way out. In order to pass through, he needs to help the ants gather food. If the ants need 911 grains of food and they already have 762, how many more grains are needed to be gathered?",1
A pet store sold 2 kittens and 1 puppy over the weekend. The kittens sold for $6 each and the puppy sold for $5. How much money did they earn from selling the pets?,3
Mrs. Hilt reads 13 books on every day that starts with the letters T and S. How many books does she read in one week?,3
Martha bought 18 small cakes. She has 3 children. She would like to divide the cakes among her children so that each child gets the same amount. How many cakes would each child get?,3
When Amy got to the fair she had $15. When she left she had $11. How much money did she spend at the fair?,0
At the produce store you can buy 2 bags of bananas for $12.46. How much would it cost if you were to buy 6 bags?,5
"If Lillian split 20 Skittles between 8 people in her class and kept the left overs, how many Skittles did each classmate get?",6
Skittles come in packages of 6. Juan ate 24 Skittles. How many Skittles does he have left?,6
For Halloween Faye scored 47 pieces of candy. She ate 25 pieces the first night and then her sister gave her 40 more pieces. How many pieces of candy does Faye have now?,2
Ethan and Frank went rowing. Ethan rowed the boat from 10:50 to 11:15. Frank rowed the boat twice as long. How long did the boys row the boat altogether?,5
"Upon finishing the treehouse, Charlie's mother served them freshly baked cookies. If Charlie ate 15 cookies, his father ate 10 and his mother only ate 5, how many cookies were eaten in total?",2
"A furniture store had fifteen chairs. After selling some, there was three left. How many chairs did they sell?",0
"Instead of buying from the store, Melody made Christmas cards for the elderly in a nursing home. She had 99 blue sequins which she plans to use as snowflakes for the cards. If she distributes the sequins equally to 12 cards, how many sequins will Melody have left?",7
A number added with thrice a number is 20. Convert this statement into algebraic equations and find the number.,8
Jenny was told to clean up her room in fourteen days or she could not go to her best friend's birthday party. It is three days left but Jenny has cleaned up her room. How many days did she spend?,0
"The capacity of a tank is 32 gallons. If a company bought 728 gallons of oil, how many tanks are needed to hold all the oil?",7
There were six roses in the vase. Jessica cut some more roses from her flower garden. There are now eighteen roses in the vase. How many roses did she cut ?,0
"A small school has 55 students. If 10 of the students are boys, what is the ratio of girls to boys?",10
"Paige had 43 math problems and 12 science problems for homework. If she finished 44 of the problems at school, how many problems did she have to do for homework?",2
"At a restaurant each adult meal costs $8 and kids eat free. If a group of 11 people came in and 2 were kids, how much would it cost for the group to eat?",4
"Finally, she planned on going to the Halloween party in the village club house. She wanted to make sure that she will have the perfect costume so she rented 4 different costumes from the Halloween store. If each costume rent costs $2.00, how much did she spend on all the costumes?",3
Rebecca wants to split a collection of eggs into groups of 2. Rebecca has 16 eggs and 3 marbles. How many groups will be created?,3
Rosa is making a game board that is 16 inches by 24 inches. She wants to use square tiles. What is the largest tile she can use?,9
58 children are taking a bus to the zoo. They sit 2 children in every seat. How many seats will the children need in all?,3
"Since the result of the vote was close, it was decided that they will balance the menu with both meat and vegetables. This decision was agreed upon by 154 third grade students and 237 fourth grade students. How many students agreed with the decision?",1
"Sarah had some trucks. She gave 13 to Jeff, and now she has 38 trucks left. How many trucks did Sarah have to start with?",2
"Her friends are coming over the next day so she also bought some refreshments. If she has $50.00 left from the money she had after buying cookies, and she has $69.00 before, how much did she spend on juice?",2
"Cody made 12 dollars mowing lawns over the summer. If he charged 4 bucks for each lawn, how many lawns did he mow?",3
"Kaleb has seventeen shirts. If he got rid of seven of them, how many shirts would Kaleb have?",0
"P and Q start at the same time in the same direction to run around a stadium. P completes a round in 252 seconds and Q in 198 seconds, both starting at the same point. After what time will they meet again at the starting point?",9
Cora sliced 18 kg of green apples for a party. She divided the apple slices equally between 5 large bowls. How many grams of apple slices did Cora put in each bowl?,5
"There's only a week left before Christmas. John went out to buy gifts for his family. Having $999.00 for his budget, he went to a sports store and bought his brother a new pair of shoes for $165.00. How much money does he have left?",1
"If Tom plans to fix 158 watches at the rate of 12 watches per day, how many days does he need to fix the watches?",7
"At the first day back in school, her parents bought her different colored pens. If her parents bought her 56 pens and she gave 22 of those to her friends, how many pens were left for her to use?",2
"When Jenna works out, she spends 18 minutes doing cardio and 20 minutes doing resistance training. Leon's workout consists of 17 minutes of cardio and 18 minutes of resistance training. Who does a higher ratio of cardio to resistance training?",11
"Bruno had some story books. He lost 4 of them and his dad gave him 10 more books. If he had 39 books after that, how many books did Bruno have at first?",2
"There are three bosses in a computer game. Boss A appears every 1 hour. Boss B appears every 30 minutes. Boss C appears every 40 minutes. If the three bosses appear together at 10:10, at what time will the three bosses appear together again in the game?",7
"Tom used 2 batteries on his flashlights, 15 in his toys and 2 in his controllers. What's the difference between the number of Tom's batteries on flashlights and in toys?",0
"For a dinner party, Abraham is creating individual servings of starters. He has 9 carrot sticks and 18 celery sticks. If he wants each serving to be identical, with no food left over, what is the greatest number of servings Abraham can create?",9
"A coat factory had 29 coats. If they wanted to put them into 3 boxes, with the same number of coats in each box, how many extra coats would they have left over?",6
"While performing a piece of music, Jacob strikes the cymbals every 7 beats and the triangle is every 2 beats. If he just struck both at the same time, how many beats will pass before he again strikes them at the same time?",9
"While shopping for music online, Zoe bought three country albums and five pop albums. Each album came with a lyric sheet and had three songs. How many songs did Zoe buy total?",4
"Daniel has 44 commemorative plates and 33 commemorative spoons. He wants to display them in groups throughout his house, each with the same combination of plates and spoons, with none left over. What is the greatest number of groups Daniel can display?",9
"A vase can hold 5 flowers. If you had 25 flowers, how many vases would you need?",3
"Three workers are working to cut the trees. Worker X can cut a tree every 16 min, Worker Y every 32 min and Worker C every 24 min. If they start cutting three trees at the same time at 7:48, at what time will they start cutting trees at the same time again?",5
A fast food restaurant had ninety-one hotdogs. After selling some they had twenty left. What's the difference between the number of hotdogs before selling and after selling?,2
"At a comic convention Janet wanted to buy 8 comics, but each one costs 4 dollars, plus it costs 2 to even get in. How much money should she take with her so she can get in and buy what she wants?",4
"There are 3300 bananas in Janice's banana collection. Janice also has 5 crayons. If the bananas are organized into 75 groups, how big is each group?",7
Dave was working as a sacker at a grocery store where he made six dollars an hour. On Monday he worked six hours and on Tuesday he worked two hours. How much money did Dave make in those two days?,3
Ted and Fred measured their height. Their total height is 98 inches. Ted is 39 inches tall. How tall is Fred?,2
Dave was working as a sacker at a grocery store where he made six dollars an hour. On Monday he worked six hours and on Tuesday he worked two hours. How much money did Dave make in those two days?,12
Some oranges were in the basket. Five oranges were taken from the basket. Now there are three oranges. How many oranges were in the basket before some of the oranges were taken?,12
"A new building needed 14 windows. The builder had already installed 5 of them. If it takes 4 hours to install each window, how long will it take him to install the rest?",2
"Lenny has $84. He spent $24 on video games, and $21 at the grocery store. How much does Lenny have left?",2
"Mr. Lee harvested 495 apples and he packed them evenly in some baskets. If there are 25 apples in each basket, how many baskets of apples are there?",7
"In 3 seconds, Kevin can dribble a basketball 13 times. If Kevin dribbles at this same rate for 27 seconds, how many times will he dribble the basketball?",11
"Megan had seventeen bottles of water. If she drank three of them, how many bottles would Megan have left?",0
"Some deer families are also moving out to avoid the shortage of grass that will result from occasional blizzards. If there are 79 deer families in the area and around 45 of them stayed, how many deer families moved out?",2
"Jack is reading a 285-page book. If he reads 23 pages per day, how many pages will he read on the last day?",7
Shirley sold 54 boxes of Trefoils. How many cases of 6 boxes does Shirley need to deliver?,3
Julia played tag with 12 kids on Monday. She played tag with 7 kids on Tuesday. How many kids did she play with altogether?,0
Lukas averages 12 points per game in basketball. How many points would he score in 5 games?,3
"Mrs. Hilt's favorite first grade classes are baking muffins. Mrs. Brier's class bakes 18 muffins, Mrs. MacAdams's class bakes 20 muffins, and Mrs. Flannery's class bakes 17 muffins. How many muffins does first grade bake in all?",2
"Mrs. Dalloway made 85 tarts. If she wants to fill 10 boxes with the same number of tarts, how many more tarts should she make?",6
"There are 396 students going to a trivia competition. If each school van can hold 9 students, how many vans will they need?",6
I have 28 cents in my pocket. How coins could I have on minimization?,3
"To add support on the house's connections, he decided to tie the wood joints with rope. He needs 185 feet of rope. If he has 46 feet of rope with him and at the moment he only needed 57 feet, how many feet of rope did his friends give to him?",4
Marcus has 210 baseball cards. He has 58 more than Carter. How many baseball cards does Carter have?,1
"Adam had 5 dollars. At the store he spent $2 on a new game. If he got another 5 dollars for his allowance, how much money does he have now?",12
"Mrs. Hilt had $4,000 in her savings account. She earned 10% interest each year. If she left that money in the account for one year, how much will she have in the account at the end of that year?",11
"A rectangle flower bed had a total area of 35 square yards. If it was 5 yards wide, how long was it?",3
I have 28 cents in my pocket. How coins could I have on minimization?,12
"Drew prepared 61 servings of butterscotch. If she expects her 6 sweet-tooth guests to share the butterscotch among them equally, how many will be left unconsumed?",6
2 birds were sitting on the fence. 4 more birds came to join them. How many birds are sitting on the fence?,12
Teacher buys 4 black pens and 4 blue pens for students as awards. How many pens does the teacher buy altogether?,12
"After paying $2.30 for a drink, Bryon has $17.15. How much money did he have before buying the drink?",5
"Sam cut equal-length pieces of ribbon from a 3,730-cm long ribbon. If each piece was 73 cm long, how many 73 cm pieces of ribbon did Sam make?",7
"Bianca had 45 coloring books. If she gave away 6 of them, but then bought 20 more, how many would she have total?",2
"I want to plant 45 sunflower plants, 81 corn plants and 63 tomato plants in my garden. If I put the same number of plants in each row and each row has only one type of plant, what is the greatest number of plants I can put in one row?",9
"If five is subtracted from three times a certain number, the result is 10. What is the number?",8
It takes 7 minutes to bake one pan of cookies. How long will it take to bake 4 pans of cookies?,3
"Packages of cheddar cheese come with 12 slices, while packages of Swiss cheese come with 28 slices. If Randy bought the same number of slices of each type of cheese, what is the smallest number of slices of each type that Randy could have bought?",9
Atomic fireballs come in packages of 9. Barbara ate 59 Atomic Fireballs. How many Atomic Fireballs does she have left?,6
Thrice the sum of a number and 2 equals 24 added with the same number. Write algebraic equation and find the number.,8
A fast food restaurant had 3 boxes of chicken nuggets for $19.53. A competing restaurant had 2 boxes of chicken fingers for $13.12. Which food has a higher unit price?,5
Rebecca wants to split a collection of eggs into groups of 2. Rebecca has 16 eggs and 3 marbles. How many groups will be created?,3
Sweettarts come in packages of 7. Stephen ate 64 Sweettarts. How many Sweettarts does he have left?,6
"While building the house, Charlie noticed that they were running out of nails so he told his father he's going to buy some. If they still have 9 nails left and Charlie bought 2 boxes of nails, the big one containing 55 nails and the small one containing 31, how many nails will they have?",2
"There are three bosses in a computer game. Boss A appears every 1 hour. Boss B appears every 30 minutes. Boss C appears every 40 minutes. If the three bosses appear together at 10:10, at what time will the three bosses appear together again in the game?",5
"Mr. Lee wants to load 134 tons of his fruits. A large truck can load 15 tons of fruits and small truck can load 7 tons. In order to use the least number of trucks and have every truck fully occupied, how many small trucks should be used?",3
"Brenda's mother made cookies for five. If she prepared 35 cookies and each of them had the same number of cookies, how many did each of them have?",3
67 medals are displayed in the sports center. There are 19 gold medals and 32 silver medals. How many bronze medals are displayed?,2
The difference of 5 times a number and 17 is 23. Find the number and 5 times the number.,8
"Jason had 27 peaches and 17 pears left at his roadside fruit stand. He went to the orchard and picked more peaches to stock up the stand. There are now 90 peaches at the stand, how many did he pick ?",2
"A container can hold four orange slices. If a company had three hundred twenty-nine orange slices to put into containers, how many more slices would they need to fill up the last container?",6
"A restaurant offers diet soda and regular soda. In one day they sold 64 sodas. If 28 of the sodas they sold were diet, what is the ratio of regular sodas sold to diet sodas sold?",0
"A P.E. teacher needs to divide 14 male students and 7 female students into teams, each with the same combination of male students and female students and nobody left out. What is the greatest number of teams that can be formed?",9
A rectangle has an area of 360 square centimeters. It is 20 centimeters long. What is its perimeter?,7
John bought some cupcakes for a party. During the party eleven were eaten. Now he has twenty-one left. How many cupcakes did John get for the party?,2
One-third of a number minus seven gives eight. Find the number.,8
It is 2:00. What time will it be in three hours and forty-five minutes?,5
The distance travelled by Ben and Tim is in the ratio 3:4. The distance travelled by Ben is 18 miles. Find the distance travelled by Tim.,11
"In Rina's desk drawer, there are 18 paper clips and 12 rubber bands. In Mia's office supply tray, there are 15 paper clips and 10 rubber bands. Who has a lower ratio of paper clips to rubber bands?",11
"There are 5 boys and 4 girls in a classroom. After 3 boys left the classroom, another 2 girls came in the classroom. How many children were there in the classroom in the end?",12
"A Girl Scout camp served half of their granola with breakfast. After dinner, they put the remaining 6250 g of granola on top of their yogurt dessert. How many kilograms of granola did the Girl Scout camp start with?",5
Mrs. Hilt has 50 cents. A pencil costs 5 cents. How many pencils can she buy with the money she has?,3
"Adam picked thirty-five strawberries. After eating some, he had thirty-three left. How many strawberries did Adam eat?",2
A lawn care company bought 4 lawnmower blade for $8 each. They also bought a spool of weed eater string for $7. How much money did they spend on supplies?,4
"A container can hold four orange slices. If a company had three hundred twenty-nine orange slices to put into containers, how many more slices would they need to fill up the last container?",12
Two bicycle enthusiasts are leaving Cincinnati at the same time. One is biking 840 miles to Boston. The other is biking 440 miles to Atlanta. What is the greatest number of miles a day each can bike if they want to cover equal distances each day?,9
15 students split 122 portfolios of paintings. Each student should get the same number of portfolios. How many portfolios of paintings will each of them get?,7
